id,name,year,rating,status,genre,episodes,time,studio,description,img
848,Тетрадь дружбы Нацумэ 5 сезон,2016,8.57,Закончен,"Сёдзё, Комедия, Драма, Повседневность, Мистика, Фэнтези",11 эп. из 11,25 мин.,Shuka,"Пятый сезон продолжает рассказ о Такаши Нацумэ, который обладает способностью видеть ёкай - духов и монстров, невидимых для обычных людей. В этом сезоне Такаши продолжает свои встречи с ёкай, помогая им разрешить их заботы и проблемы. Каждый эпизод представляет новое приключение, в котором Такаши сталкивается с разными ёкай и узнает их истории. В то время как он помогает ёкай, он также изучает свои собственные чувства и взаимодействует с друзьями, духами и своим прошлым. Сезон обогащает мир",https://animego-online.org/uploads/posts/2023-08/481534_1691605022.jpg
849,Моя геройская академия 2 сезон,2016,8.12,Закончен,"Сёнен, Комедия, Школа, Суперсила, Фантастика, Экшен",25 эп. из 25,23 мин.,Bones,"В этом сезоне герои продолжают свои обучение и борьбу за справедливость и безопасность. Сюжет развивается дальше, представляя новых персонажей, расскрывая дополнительные аспекты мира с Квирками и раскрывая больше тайн и историй героев. Второй сезон также включает в себя разнообразные события, сражения и развитие отношений между персонажами. Этот сезон углубляет зрителей в мир героев и геройства, исследуя их мечты, цели и преграды.",https://animego-online.org/uploads/posts/2023-08/1691850083_12.jpg
850,Дюрарара 2 сезон 3 часть,2016,8.06,Закончен,"Детектив, Приключения, Мистика, Фэнтези, Экшен",12 эп. из 12,25 мин.,Shuka,"Третий и завершающий сезон продолжения аниме. В этом сезоне все неразгаданные загадки, интриги и сюжетные линии достигают своего кульминационного момента. Судьбы персонажей переплетаются, и множество тайн становятся ясными. Конфликты, которые накопились в предыдущих сезонах, достигают своей развязки, и персонажи сталкиваются с последствиями своих действий. Серия событий начинает раскрывать более глубокие слои мира ""Durarara!!"", включая мистические и сверхъестественные аспекты, а также",https://animego-online.org/uploads/posts/2023-08/880650_1691604422.jpg
851,Орендж,2016,7.62,Закончен,"Сёдзё, Романтика, Школа, Драма, Фантастика",13 эп. из 13,24 мин.,Telecom Animation Film,"Сюжет рассказывает о Нахасэ Какеру, старшекласснице, которая получает письмо из будущего. В этом письме она узнает, что новенький парень в их классе, Какари Нарусу, станет причиной ее друзей, Какеру самой исключительной подруги, Суа, впадут в глубокую депрессию и в итоге закончат жизнь самоубийством. Стремясь изменить будущее, Какеру и ее друзья начинают действовать, чтобы помочь Нарусу и изменить ход событий. Время от времени они отправляют письма в будущее, пытаясь управлять ситуацией и",https://animego-online.org/uploads/posts/2023-08/1003934_1691604241.jpg
852,Первоклассный адвокат 2 сезон,2016,7.16,Закончен,"Комедия, Детектив, Драма, Полиция, Криминал",23 эп. из 23,24 мин.,CloverWorks,"Она продолжает рассказ о Финиксе Райте и его команде, следуя формату разбора судебных дел и расследований. Второй сезон продолжает исследование различных дел, каждое из которых представляет собой уникальную историю и интриги. Сериал продолжает развивать характеры и динамику группы адвокатов и следователей, а также поднимает вопросы личного роста, моральных дилемм и ценности правосудия.",https://animego-online.org/uploads/posts/2023-08/1007460_1691603882.jpg
853,Вечно ленивый Танака,2016,7.83,Закончен,"Комедия, Школа, Повседневность",12 эп. из 12,25 мин.,SILVER LINK.,"Это аниме-сериал, который фокусируется на повседневных приключениях и взаимодействиях главного героя, Танаки, который всегда выглядит апатичным и безразличным ко всему. Он не любит тратить излишне много энергии и всегда ищет способы, чтобы провести время в состоянии максимального покоя. Его одноклассница Ота, яркая и энергичная, часто становится его компаньоном, пытаясь разнообразить его жизнь и помочь ему найти вдохновение. Аниме создаёт комедийные ситуации, связанные с характером Танаки и его",https://animego-online.org/uploads/posts/2023-08/976637_1691603701.jpg
854,Мартовский лев 1 сезон,2016,8.38,Закончен,"Драма, Повседневность, Спорт",22 эп. из 22,25 мин.,Shaft,"Это аниме-сериал, основанный на манге Чика Умино. Сюжет следует за Кирю Хинатой, 17-летним профессиональным игроком в шоги (японская настольная игра), который борется с внутренними демонами и трудностями после потери родителей и давлении в мире профессионального шоги. В процессе истории Хината встречает семью трех сестер, сталкивается с их собственными личными борьбами и становится частью их жизни. По мере того как он взаимодействует с этими девушками и другими персонажами, он начинает",https://animego-online.org/uploads/posts/2023-08/1045799_1691603521.jpg
855,Встречи с Тававой по понедельникам,2016,6.42,Закончен,"Комедия, Повседневность, Этти",12 эп. из 12,4 мин.,PINE JAM,"Это аниме-короткометражка, основанная на веб-манге, которая представляет собой романтическую срез-жизни и драму. Сюжет состоит из коротких эпизодов и сосредотачивается на повседневных встречах и взаимоотношениях между главным героем и разными девушками. Главный герой, Натцуки Сома, ежедневно встречается с девушкой на станции метро в понедельник – ""getsuyoubi"" на японском, отсюда и название аниме. В течение этих встреч они обмениваются небольшими беседами, наблюдениями и разговорами.",https://animego-online.org/uploads/posts/2023-08/1338004_1691603162.jpg
856,Этот замечательный мир 1 сезон,2016,8.11,Закончен,"Комедия, Магия, Пародия, Приключения, Фэнтези, Исекай",10 эп. из 10,24 мин.,Studio Deen,"Это аниме-сериал, который представляет собой комедийное путешествие в фэнтезийный мир. Главный герой, Кадзума Сато, умирает в результате несчастного случая, но ему предоставляется второй шанс на жизнь в ином мире. Его первым актом в новом мире становится выбор богини, которая готова исполнить ему одно желание перед отправкой. Вместо того чтобы попросить что-то полезное, Кадзума выбирает взять с собой эту богиню, по имени Аква, чтобы совершить подвиги в мире. Однако, новый мир оказывается",https://animego-online.org/uploads/posts/2023-08/972251_1691602861.jpg
857,Магазинчик сладостей 1 сезон,2016,6.61,Закончен,"Сёнен, Комедия, Повседневность",12 эп. из 12,24 мин.,feel.,"Это аниме-сериал и адаптация манги о мире дагаси (недорогие сладости и закуски), а также о культуре и традициях, связанных с этими продуктами. Сюжет фокусируется на Коконе Сая, которая живет в деревне и должна взять на себя управление магазином дагаси своего отца. Однако её желание стать художником манги ставит под вопрос её принятие семейных обязанностей. События начинаются, когда в деревню приезжает Хотару Шидара, энтузиастка дагаси, чтобы попытаться уговорить Коконе остаться в магазине.",https://animego-online.org/uploads/posts/2023-08/968635_1691602622.jpg
858,Кабанери железной крепости,2016,7.27,Закончен,"Драма, Ужасы, Фэнтези, Экшен",12 эп. из 12,22 мин.,Wit Studio,"Сюжет разворачивается в альтернативной версии Феодальной Японии, где человечество находится под угрозой из-за кабанери - существ, которые появились в результате инфекции зомби и обладают силой, выносливостью и жаждой плоти. Они могут быть уничтожены только при попадании в определенные места их тела. Главный герой, Икома, является гениальным механиком и одним из выживших, осталось отчаянных попыток сдержать нападение кабанери. Икома становится кабанери после того, как его укусили. Однако, в",https://animego-online.org/uploads/posts/2023-08/975655_1691602561.jpg
860,Моя геройская академия 1 сезон,2016,7.89,Закончен,"Сёнен, Комедия, Школа, Суперсила, Фантастика, Экшен",13 эп. из 13,23 мин.,Bones,"Это аниме, происходящее в мире, где большинство людей обладает сверхъестественными способностями, называемыми ""Квирки"". Главный герой, Изуку Мидория, рождается без Квирка, но мечтает стать героем, как его кумир Всемогущий Герой ""Великий Могучий"". Судьба ведет его к Всемирной Академии Героев, где будущие герои обучаются использованию своих способностей для защиты общества. Сериал следует за Изуку и его друзьями в их приключениях, тренировках и сражениях с врагами. В процессе",https://animego-online.org/uploads/posts/2023-08/1691850079_11.jpg
861,Герой мёртв,2023,6.65,Закончен,"Комедия, Гарем, Демоны, Пародия, Фэнтези, Экшен, Этти",12 эп. из 12,23 мин.,LIDENFILMS,"Мир оказывается под угрозой, исходящей от Короля Демонов, но для спасения не обязательно убивать его. Достаточно запечатать Врата, через которые он направляет свою армию. Задачу запечатывания Врат успешно выполняет Шион Бленден, обладающий мечом Экскалибуром. Однако он наложил печать лишь частично, и со временем она начала ослабевать. Демоны вновь проникают в мир людей и атакуют их. Теперь фермер Токи Скотт принимает на себя задачу остановить демонов с помощью ям-ловушек. В ходе одной из таких",https://animego-online.org/uploads/posts/2023-08/5310753_1691429761.jpg
862,Великий из бродячих псов 1 сезон,2016,7.82,Закончен,"Комедия, Детектив, Приключения, Мистика, Суперсила, Фантастика, Экшен",12 эп. из 12,23 мин.,Bones,"История развивается в мире, где некоторые литературные величины обладают сверхъестественными способностями и действуют в различных организациях. Основной герой, Атсуши Накадзима, после случайного столкновения с членами организации ""Агенство Детективов"", обнаруживает, что он обладает способностью превращаться в белого тигра. Он решает присоединиться к этому агентству, которое борется с преступностью с использованием своих литературных способностей. Вместе с командой детективов, включая",https://animego-online.org/uploads/posts/2023-08/1691862327_21.jpg
863,"Город, в котором меня нет",2016,8.31,Закончен,"Детектив, Драма, Психология, Мистика, Фантастика, Триллер",12 эп. из 12,25 мин.,A-1 Pictures,"Сюжет аниме следует за Сатору Фудзинумой, молодым автором манги, который обладает способностью ""реверта"" - он может вернуться во времени на короткий период, чтобы предотвратить негативные события. Когда его мать становится жертвой серийного убийцы, Сатору возвращается в прошлое до его детства, когда он был школьником. В прошлом он пытается раскрыть тайну идентичности убийцы и предотвратить преступления, которые приведут к смерти его матери и других детей. В ходе расследования он также",https://animego-online.org/uploads/posts/2023-08/957840_1691600466.jpg
864,Психопаспорт 1 сезон,2012,8.34,Закончен,"Детектив, Полиция, Криминал, Психология, Фантастика, Экшен, Триллер",22 эп. из 22,25 мин.,Production I.G,"Сюжет аниме разворачивается в будущем, где технология позволяет измерять психическое состояние и личность людей с помощью устройства, называемого Психопаспорт. Этот инструмент также используется для определения того, насколько вероятно, что человек совершит преступление - его ""криминальный коэффициент"". Главная героиня, Акане Цунемори, присоединяется к Отделу Общественной Безопасности, где она сталкивается с разными преступлениями и раскрывает тайны, связанные с тем, как функционирует",https://animego-online.org/uploads/posts/2023-08/1691906750_12.jpg
865,Гинтама 5 сезон,2017,8.99,Закончен,"Сёнен, Комедия, Пародия, Самураи, Фантастика, Фэнтези, Экшен",12 эп. из 12,24 мин.,Bandai Namco Pictures,"Сериал продолжает историю приключений Гинтоки и его друзей в альтернативной версии периода Эдо. События сериала развиваются после событий прошлого сезона и продолжают смешивать комедийные и драматические элементы. Главные персонажи - Гинтоки, Шинпачи и Кагура - сталкиваются с новыми ситуациями, врагами и приключениями, сохраняя характерный стиль аниме с пародиями на различные жанры и культурные явления. Сериал продолжает играть на разнообразных эмоциях, предоставляя зрителям как смешанный юмор,",https://animego-online.org/uploads/posts/2023-08/16.jpg
866,Сэйрэн,2017,6.28,Закончен,"Комедия, Романтика, Школа, Гарем",12 эп. из 12,24 мин.,"Studio Gokumi, AXsiZ","Сюжет аниме разворачивается в течение трех различных историй, каждая из которых фокусируется на разных героях и их отношениях. Каждая история представляет собой отдельный путь и вариант развития событий, хотя они происходят в одной и той же школе. Первая история фокусируется на Хикари Цунаши и её отношениях с главным героем. Вторая история рассказывает о Тору Хаяма и его романтических исканиях. Третья история сосредотачивается на Кёко Кадзуне и её взаимодействии с другими персонажами. Сериал",https://animego-online.org/uploads/posts/2023-08/1009282_1691597046.jpg
867,Возрождающие,2017,7.55,Закончен,"Меха, Фантастика, Фэнтези, Экшен",22 эп. из 22,24 мин.,TROYCA,"Это аниме сериал, сочетающий элементы фэнтези, приключений и метафикции. Сюжет развивается в мире, где персонажи из различных миров манги, аниме, видеоигр и литературных произведений внезапно начинают появляться в реальном мире. Оказавшись в мире, который для них является фикцией, эти персонажи обретают реальное сознание и индивидуальность. Главный герой - Сота Мизушино, обычный старшеклассник и поклонник фэнтези. Он случайно обнаруживает, что его любимые персонажи из историй внезапно стали",https://animego-online.org/uploads/posts/2023-08/1111095_1691595721.jpg
868,Ловушка лжи,2017,5.33,Закончен,"Сёдзё-ай, Романтика, Драма",12 эп. из 12,9 мин.,Creators in Pack,"Это аниме-сериал, который базируется на манге с тем же названием и относится к жанру романтики, драмы и школьной жизни. Сюжет фокусируется на сложных отношениях между главными героинями и их попытках разобраться в своих чувствах. История следует за двумя лучшими подругами - Юма Окада и Хотару Мизуширо. На первый взгляд, они - образцовые школьные девушки, но постепенно становится ясно, что между ними происходит нечто большее, чем дружба. Юма и Хотару вступают в опасную игру сексуальной и",https://animego-online.org/uploads/posts/2023-08/1048164_1691595242.jpg
869,В песках поющие китята,2017,7.17,Закончен,"Сёдзё, Детектив, Драма, Суперсила, Фантастика, Фэнтези",12 эп. из 12,23 мин.,J.C.Staff,"Это аниме-сериал, адаптация манги одноименного названия. Оно объединяет элементы фэнтези, драмы и мистики, создавая уникальный мир и исследуя сложные взаимоотношения между героями. Сюжет разворачивается в вымышленном мире, в котором живут две разные группы людей: одни на плавучих островах, путешествующих по песчаному океану, а другие обитают на огромных китах-островах, которые двигаются вглубь этого океана. Островные жители обладают способностью использовать псионические силы, а их общество",https://animego-online.org/uploads/posts/2023-08/1111902_1691593262.jpg
870,Зверь в юбке,2017,5.42,Закончен,Драма,12 эп. из 12,5 мин.,Magic Bus,"Этот аниме повествует о необычной встрече между обычной девушкой и таинственным парнем. Девушка случайно обнаруживает, что этот парень на самом деле скрывается под её юбкой и обладает сверхъестественной силой. Вместо того чтобы выдать его, она решает помочь ему скрыть свою тайну, и между ними начинается сложное взаимодействие, в котором раскрываются неожиданные аспекты личности.",https://animego-online.org/uploads/posts/2023-08/1111680_1691592482.jpg
