id,name,year,rating,status,genre,episodes,time,studio,description,img
289,Непревзойдённый царь небес 2 сезон,2021,7.0,Онгоинг,"Приключения, Мистика, Фэнтези, Экшен",64 эп. из 240,7 мин.,Ruo Hong Culture,"Десять тысяч лет назад бессмертный король Му Юнь стал жертвой заговора других лиц из-за своего владения Чжу Сянту. После десяти тысяч лет сна его остаточная душа пробудилась в теле известного ""Мусорного Му Юня"" Южной Облачной Империи на континенте Небесной Судьбы.",https://animego-online.org/uploads/posts/2023-08/1692677654_11.jpg
290,Грация духа,2017,7.12,Закончен,"Боевые искусства, Приключения",3 эп. из 12,23 мин.,Sunflowers,"Фэн Линъэр больше не идет в одиночестве. В ее путешествие вступает загадочная девушка с белыми волосами. Она остается практически неизвестной, и лишь немногие осознают, какая огромная сила скрыта за хрупкой и привлекательной внешностью этой красавицы. Девушка испытывает глубокую ненависть к Тьме и делает все, что в ее силах, чтобы приобрести мощное оружие и вступить в схватку с ненавистными врагами. Ни девушка, ни Фэн Линъэр не обращают внимания на тех, кто пытается активно обсудить их",https://animego-online.org/uploads/posts/2023-08/64e433f66b8de_1692677110.jpg
291,Вечная воля,2020,7.79,Закончен,"Комедия, Боевые искусства, Фэнтези, Экшен",52 эп. из 52,19 мин.,B.CMAY PICTURES,"Аниме рассказывает историю Бай Сяочуна, милого, но вызывающего смешанные чувства молодого человека, который прежде всего движим своим страхом смерти и желанием жить вечно, но глубоко ценит дружбу и семью.",https://animego-online.org/uploads/posts/2023-08/64e4335fe7292_1692676959.jpg
292,Бог войны,2021,5.83,Закончен,"Космос, Меха, Фантастика, Экшен",12 эп. из 12,24 мин.,"Seven Stone Entertainment, TrioPen Studio","В конце 21-го века открытие нового источника энергии, названного ""DG-энергия"" (сокращение от ""божественная энергия благодати""), полностью изменило экономику Земли и позволило человечеству колонизировать космос. Однако, когда первая экспедиция достигает Плутона, их атакует загадочное гигантское существо, известное как ""Нергал"". Армия Земного Альянса противостоит атакам, создавая ""AG Unit"" с использованием древних роботизированных оружий, известных как",https://animego-online.org/uploads/posts/2023-08/64e432a5009f2_1692676773.jpg
293,Вечная жизнь,2022,7.15,Закончен,"Боевые искусства, Приключения, Фэнтези, Экшен",12 эп. из 12,24 мин.,Oriental Creative Color,"Фан Хан, скромный раб в семье, с детства исповедовал убеждение: ""Я лучше буду попрошайкой, чем рабом"". Он самостоятельно путешествовал по миру. Неустрашимой упорством он преодолел загадки сверхъестественных сил и сделал свое тело бессмертным. Трудился усердно, шаг за шагом входя в мир фей, и, в конечном итоге, достиг вершины королей.",https://animego-online.org/uploads/posts/2023-08/64e432720aa8e_1692676722.jpg
294,Антидот,2020,7.07,Закончен,"Сёнен-ай, Комедия, Повседневность",13 эп. из 13,18 мин.,Seven Stone Entertainment,"История аниме погружает зрителей в захватывающий мир истории о Чэнь Кэ, талантливом художнике, который вынужден покинуть свой дом по разным обстоятельствам. В начале своей новой жизни он сталкивается с Цзян Идуо, молодым человеком, производящим грубое впечатление, что неизбежно приводит к конфликту между ними. Но со временем главный герой начинает раскрывать тайны своего соперника и получает доступ к квартире, которой владеет Цзян Идуо. Сюжет эволюционирует, и молодые люди осознают, что",https://animego-online.org/uploads/posts/2023-08/64e4319db3d17_1692676509.jpg
295,У Коми проблемы с общением 1 сезон,2021,7.91,Закончен,"Сёнен, Комедия, Романтика, Школа, Повседневность",12 эп. из 12,24 мин.,OLM,"Это аниме, основанное на популярной манге одноименного названия. Сюжет фокусируется на главной героине по имени Шоко Коми, которая известна в школе своей красотой и изящностью, но также и своей крайней неспособностью к общению. Она страдает от социальной фобии и не может произнести ни слова в присутствии других людей, из-за чего она не может завести друзей. Однажды Шита Тадано, обычный парень из её класса, случайно узнает о её проблеме. Вместо того чтобы выдать её секрет, он решает помочь Коми",https://animego-online.org/uploads/posts/2023-08/4480177_1691481602.jpg
296,Сатана на подработке 1 сезон,2013,7.75,Закончен,"Комедия, Демоны, Магия, Фэнтези",13 эп. из 13,25 мин.,White Fox,"Это аниме, которое начинается в фэнтезийном мире, где Мао - Король Демонов - пытается завоевать Ентегельсское Королевство, но его планы рушатся, и он и его верный генерал Альсиэль оказываются в современном Токио без магических способностей. В мире без магии Мао вынужден работать на низкооплачиваемой работе в сети быстрого питания, чтобы выживать. Вместе с Альсиэлем, который стал обычным человеком, они ищут способы вернуть свои способности и восстановить свой статус. В ходе адаптации к жизни в",https://animego-online.org/uploads/posts/2023-08/760019_1691677982.jpg
297,Месть Масамунэ 1 сезон,2017,6.74,Закончен,"Сёнен, Комедия, Романтика, Школа, Гарем, Драма",12 эп. из 12,24 мин.,SILVER LINK.,"Когда Масамуне Макабэ был ребенком, его отвергла богатая и красивая девушка по имени Аки Адагаки, которая дала ему прозвище ""Поросенок"" из-за его лишнего веса. Расстроенный, Масамуне приложил огромные усилия, чтобы подтянуть свою внешность. Теперь красивый, но самонадеянный старшеклассник, Масамуне решает отомстить — он заставит Аки безумно влюбиться в него, а затем отклонит ее, когда они встретятся снова. К удивлению Масамуне, он переводится в школу Аки. Воплотив свой план в жизнь,",https://animego-online.org/uploads/posts/2023-08/1691898080_13.jpg
298,"Этот герой неуязвим, но очень осторожен",2019,7.49,Закончен,"Комедия, Магия, Пародия, Приключения, Фэнтези, Экшен, Исекай",12 эп. из 12,23 мин.,White Fox,"Сюжет фокусируется на главном герое, Сейюе Оногори, который вызывается в другой мир, чтобы спасти его от разрушительных монстров и злодеев. Однако вместо того чтобы немедленно отправиться на задание, Оногори становится чересчур осторожным и начинает тренироваться и подготавливаться на каждом этапе. Он переоснащает себя и героиню этого мира, Ристарту, до тех пор, пока они не станут почти неуязвимыми. Однако его избыточная осторожность и бесконечные проверки приводят к тому, что задачи, которые",https://animego-online.org/uploads/posts/2023-08/1304637_1691531767.jpg
299,Патриотизм Мориарти 2 сезон,2021,8.27,Закончен,"Сёнен, Детектив, Криминал, Психология, Триллер",13 эп. из 13,23 мин.,Production I.G,"Сюжет разворачивается в Лондоне XIX века и рассказывает о молодом Профессоре Мориарти, известном как Уильям Джеймс Мориарти, и его братьях, Альберте и Луисе. Вместо того чтобы быть злодеем, Профессор Мориарти стремится к реформам в социальной структуре и противостоит богатым и влиятельным членам общества, которые злоупотребляют своей властью и богатством. Он использует свои гениальные интеллект и хитрость, чтобы прийти на помощь нуждающимся и обеспечить им справедливость. Главный конфликт в",https://animego-online.org/uploads/posts/2023-08/1403905_1691482502.jpg
300,Патриотизм Мориарти 1 сезон,2020,8.16,Закончен,"Сёнен, Детектив, Криминал, Психология, Триллер",11 эп. из 11,23 мин.,Production I.G,"Сюжет аниме фокусируется на истории прошлого профессора Джеймса Мориарти, известного как архивилайк Мориарти, который становится ""преступником на благо общества"". Он решает использовать свой гений и способности для наказания богатых и влиятельных людей, которые безнаказанно совершают преступления против бедных и слабых. С Мориарти сотрудничают братья Уильям и Луис Джеймсон, бывшие сироты, чья жизнь и будущее были разрушены богатыми и влиятельными семьями. Вместе они проводят свои",https://animego-online.org/uploads/posts/2023-08/1403905_1691518622.jpg
301,Давайте сыграем,2018,8.19,Закончен,"Сейнен, Комедия, Школа",12 эп. из 12,24 мин.,Lerche,"Сюжет следует за трёмя девушками – Оливия, Касуми и Ханако, которые образуют клуб по интересам для разнообразных забав и развлечений. Однако, то, что начинается как обычные школьные мероприятия, быстро превращается в полный абсурда и комический хаос. Каждая из девушек обладает уникальными чертами характера: Оливия – белокожая иностранка, которая симулирует свои знания японского языка; Касуми – обаятельная, но ужасно неловкая девушка; Ханако – строгая и серьёзная староста. Вместе они",https://animego-online.org/uploads/posts/2023-08/1223938_1691554746.jpg
302,Песнь ночных сов,2022,8.0,Закончен,"Сёнен, Комедия, Романтика, Вампиры, Мистика, Фэнтези",13 эп. из 13,23 мин.,LIDENFILMS,"Мори Коу страдает от бессонницы и обнаруживает, что его обычная жизнь просто наполнилась разочарованиями. Чтобы разбавить монотонность, он начинает совершать ночные прогулки. Во время одной из таких прогулок, он встречает девушку с голубыми глазами, у которой невероятно привлекательная улыбка. Они начинают разговор и она предлагает свою помощь в борьбе с бессонницей. Её интерес к нему не случаен. Оказывается, что он обладает уникальными способностями, схожими с теми, что были у могущественного",https://animego-online.org/uploads/posts/2023-08/4747023_1691431442.jpg
303,Невероятные приключения Джоджо 5 сезон 3 часть,2022,8.62,Закончен,"Сёнен, Комедия, Детектив, Приключения, Криминал, Мистика, Суперсила, Фэнтези, Экшен",14 эп. из 14,24 мин.,David Production,"Действие разворачивается на территории Соединенных Штатов Америки, в учреждении правопорядка под названием Грин Долфин Стрит, находящемся в пригороде Флориды. Центральной героиней выступает Джолин Куджо, дочь выдающейся личности Джотаро Куджо, известной по предыдущим сюжетам. Сюжет начинает свой поворот с неправомерного обвинения Джолин в совершении преступления, в результате чего она попадает за решетку этой учреждения. Проведя время взаперти, она обнаруживает, что обладает особым даром,",https://animego-online.org/uploads/posts/2023-08/707636_1691431321.jpg
304,Повесть о конце света 2 сезон,2023,7.52,Закончен,"Сейнен, Драма, Мистика, Суперсила, Фэнтези, Экшен",15 эп. из 10,24 мин.,"Yumeta Company, Graphinica","Сюжет описывает турнир Рагнарек, события которого являются роковыми и определяются смертью богов и людей. Победа в этом турнире достигается, когда душа полностью уничтожается, и самой страшной участью становится полное исчезновение души. Первые два поединка выиграли боги, а третий - человек. Четвертый поединок, в котором участвует Геракл, вызывает особый интерес, так как боги решают приложить максимум усилий, чтобы одержать победу, не желая проигрывать человеку. Геракл сражается в этом",https://animego-online.org/uploads/posts/2023-08/4294938_1691426102.jpg
305,Сбережение восьмидесяти тысяч золотых монет в другом мире к моей старости,2023,6.94,Закончен,"Комедия, Магия, Приключения, Фантастика, Фэнтези, Исекай",12 эп. из 12,23 мин.,Felix Film,"Эта история повествует о восемнадцатилетней девушке Ямано Мицуве, которая стала сиротой после несчастного случая. Однако судьба дополнительно испытывает ее, отправляя в другой мир, где уровень цивилизации соответствует Средневековью. В этом ином мире Мицува выживает в схватке с волками и находит способ перехода обратно в свой мир. От этого момента она становится путешественницей между двумя мирами. Для того чтобы обеспечить свое будущее и безопасность, Мицува решает добиться немалой суммы денег",https://animego-online.org/uploads/posts/2023-08/5270706_1691442601.jpg
306,Чёрный клевер Фильм: Меч короля магов,2023,8.1,Закончен,"Сёнен, Комедия, Магия, Фэнтези, Экшен",Фильм,110 мин.,Pierrot,"Юлиус и Конрад оказались в глубоком конфликте, который мог привести к серьезному сражению. В центре внимания находилось национальное сокровище. Ситуация становилась все более напряженной. Юлиус был готов взять на себя ответственность и стать королем магов, чтобы примирить обе стороны. Конрад не собирался сдаваться, особенно перед Юлиусом. Единственное, что отложило разрешение конфликта, это временное перемирие. В королевстве, владении Конрада, проходил турнир поединков под названием «Триумф».",https://animego-online.org/uploads/posts/2023-08/5126555_1691919422.jpg
307,Брошенный кролик,2011,8.36,Закончен,"Дзёсей, Комедия, Драма, Повседневность",11 эп. из 11,25 мин.,Production I.G,"Аниме рассказывает историю Даикачи Кавасе, 30-летнего холостяка, который внезапно решает взять на себя заботу о своей 6-летней родственнице, Рине, после смерти ее матери. Начинается путешествие Даикачи в мире родительства, где он сталкивается с новыми ответственностями, радостями и трудностями, связанными с воспитанием ребенка. Сюжет следует за их повседневной жизнью, борьбой с вызовами воспитания и развитием их связи. Они оба растут, учатся друг у друга и создают особенную узу. Аниме исследует",https://animego-online.org/uploads/posts/2023-08/629591_1691710681.jpg
308,Созданный в Бездне: Блуждающие сумерки,2019,8.37,Закончен,"Детектив, Драма, Приключения, Фантастика, Фэнтези",Фильм,110 мин.,Kinema Citrus,"Фильм представляет собой компиляцию эпизодов с 9 по 13 телесериала 2017 года. Рико и Рег отправляются на третий уровень, где Рико впервые сталкивается с Проклятием. Они спускаются на четвертый уровень, где Рико получает травму руки от Орбед Пирсера, и Рег пытается ей помочь. Наначи приходит им на помощь и спасает отравленную руку Рико. В знак благодарности Наначи просит Рега убить её бессмертную спутницу Митти. После этого Наначи присоединяется к Рико и Регу в их стремлении достичь дна Бездны.",https://animego-online.org/uploads/posts/2023-08/1252281_1692216362.jpg
309,Небесный замок Лапута,1986,8.26,Закончен,"Романтика, Магия, Приключения, Фантастика, Фэнтези",Фильм,125 мин.,Studio Ghibli,"Фильм рассказывает о Пазу, девочке из городка, и Шепарде, молодом парне, которые отправляются на поиски летающего замка, о котором она услышала от своего дедушки. Они раскрывают тайну древней цивилизации и древней магии, которые связаны с технологическими чудесами. Вместе они сталкиваются с опасностями и врагами, стремясь защитить замок в небесах от тех, кто хочет использовать его силу во зло. Фильм исследует темы приключений, дружбы, науки и магии. Он воссоздаёт мир фантазий и таинственности,",https://animego-online.org/uploads/posts/2023-08/1846_1692204667.jpg
310,Мой сосед Тоторо,1988,8.25,Закончен,"Приключения, Мистика, Фэнтези",Фильм,86 мин.,Studio Ghibli,"Это один из самых известных анимационных фильмов студии Studio Ghibli. Фильм рассказывает о сёстрах, Сацуки и Мэй, которые переезжают в деревенский дом, чтобы быть ближе к больнице, где находится их мать. В этом доме они обнаруживают магический мир и дружат с добродушными лесными духами, включая Тоторо. Тоторо - это огромный, пушистый существо с ушками, живущий в лесу. Он помогает девочкам встречать трудности и радости своей новой жизни, включая общение с магией и загадочными моментами. Фильм",https://animego-online.org/uploads/posts/2023-08/8221_1692204062.jpg
