id,name,year,rating,status,genre,episodes,time,studio,description,img
580,Лилии на ветру 1 сезон,2011,7.57,Закончен,"Сёдзё-ай, Комедия, Школа",12 эп. из 12,25 мин.,Doga Kobo,"Сюжет аниме сосредотачивается вокруг четырёх девочек: Акари Акадзаки, Юи Фунами, Кёко Тавара и Чинати Ямамото, которые вместе создают клуб ""Amusement Club"" в своей школе. Клуб по сути является местом, где девочки проводят свободное время, занимаясь различными дурацкими и забавными занятиями, обсуждают свои школьные будни, фантазируют и просто наслаждаются компанией друг друга. В центре внимания сериала — их повседневные события, приключения и взаимоотношения. Главной особенностью",https://animego-online.org/uploads/posts/2023-08/688059_1691725801.jpg
581,Жаркие деньки 1 сезон,2011,6.86,Закончен,"Приключения, Фэнтези, Экшен",13 эп. из 13,24 мин.,Seven Arcs,"Сюжет разворачивается в мире Флондор, где войны заменены спортивными соревнованиями и битвами, известными как ""войны героев"". Главный герой - Синки Ицукэ, обычный японский студент, которого волшебным образом транспортируют в мир Флондор. Там он сталкивается с королевой Кристиной и её подданными - героями, которые воплощают силу и доблесть разных животных. Он присоединяется к команде героев и становится частью войны, где противостоят различные нации Флондора. Герои сражаются в",https://animego-online.org/uploads/posts/2023-08/692459_1691724061.jpg
582,Бесконечные небеса 2 сезон,2013,6.47,Закончен,"Комедия, Гарем, Меха, Фантастика, Экшен, Этти",12 эп. из 12,24 мин.,8bit,"События второго сезона разворачиваются после событий первого сезона и фокусируются на дальнейших приключениях главного героя - Оримуры Ичики, в мире, где оружие под названием ""Infinite Stratos"" - это эксклюзивные боевые костюмы, которые могут использовать только женщины. Ичика - единственный мужчина, который способен управлять Infinite Stratos, что делает его объектом внимания со стороны множества девушек, учащихся в женской академии, где обучают использованию Infinite Stratos. Во",https://animego-online.org/uploads/posts/2023-08/600880_1691723642.jpg
583,Отвязная троица 2 сезон,2011,7.66,Закончен,"Сёнен, Комедия, Школа, Повседневность",8 эп. из 8,25 мин.,Bridge,"Сюжет разворачивается вокруг семейных комедийных ситуаций и повседневных приключений трех двойняшек-сестёр Марии, Мидзуки и Мику, а также их школьных друзей и учителей. Действия происходят в обычной японской средней школе, где девочки сталкиваются с различными комическими ситуациями и нелепыми моментами. Сёстры Мицудомоэ обладают яркими и эксцентричными характерами, и их взаимодействие с окружающими создает комедийные сцены, включающие в себя недоразумения, недоразумения и забавные",https://animego-online.org/uploads/posts/2023-08/542292_1691723042.jpg
584,Заморозка 1 сезон,2011,6.8,Закончен,"Романтика, Драма, Фантастика, Экшен, Этти",12 эп. из 12,24 мин.,A.C.G.T.,"Сюжет разворачивается в будущем, где Землю атакуют загадочные и смертоносные существа, известные как ""Новые виды"". Человечество сражается с ними при помощи особых боевых единиц, называемых ""Пандорами"", и их мужских партнеров, называемых ""Стигмами"". Эти партнеры обладают способностью замораживать Новых видов, чтобы облегчить задачу Пандор. Главная героиня - Казуя Аой, новая студентка в Генетической академии, где обучают будущих Пандор и их Стигм. Казуя обладает",https://animego-online.org/uploads/posts/2023-08/593016_1691722621.jpg
585,Макен-Ки: Не проиграю 1 сезон,2011,6.33,Закончен,"Комедия, Школа, Боевые искусства, Гарем, Магия, Приключения, Суперсила, Фэнтези, Экшен, Этти",12 эп. из 12,25 мин.,AIC Spirits,"Сюжет разворачивается вокруг главного героя, Такаки Оямы, который поступает в академию Тенё, специализирующуюся на боевых искусствах и магических битвах. В этой академии боевые навыки и магические способности определяются специальными артефактами, называемыми ""Макен"". Оказавшись в новой среде, Такаки сталкивается с группой девушек, которые также обучаются в академии и обладают различными типами Макен. Он быстро присоединяется к группе и сталкивается с различными соревнованиями,",https://animego-online.org/uploads/posts/2023-08/683889_1691722142.jpg
586,Персона 4 1 сезон,2011,7.5,Закончен,"Школа, Детектив, Приключения, Мистика, Суперсила, Фантастика, Фэнтези, Экшен, Триллер",25 эп. из 25,25 мин.,AIC ASTA,"Сюжет разворачивается в городе Инаба, где происходят загадочные убийства. Главный герой - Ю Наруками - переезжает в Инаба и начинает исследовать эти убийства вместе с новыми друзьями. Ю и его друзья обнаруживают, что есть связь между убийствами и загадочным миром, известным как ""Теневой мир"". В этом мире они обретают способности под названием ""Персона"", которые помогают им сражаться с монстрами и разгадывать тайны убийств. Вся история развивается вокруг исследования",https://animego-online.org/uploads/posts/2023-08/666697_1691722021.jpg
587,Лучшая в мире первая любовь 2 сезон,2011,7.85,Закончен,"Сёнен-ай, Комедия, Романтика, Драма",12 эп. из 12,23 мин.,Studio Deen,"Сериал основан на манге Шундзё Ёнаги, и его сюжет сосредотачивается на романтических и межличностных взаимоотношениях в мире издательства манги. Главный сюжет фокусируется на различных парах в мире издательства ""Марука"". Второй сезон продолжает истории персонажей, представленных в первом сезоне, и раскрывает их отношения, драмы и развитие в рамках профессиональной и личной сферы. Сериал также поднимает вопросы о том, как влияют прошлые опыты, страхи и надежды на текущие отношения.",https://animego-online.org/uploads/posts/2023-08/588922_1691721061.jpg
588,Карточные бои «Авангарда» 1 сезон,2011,7.02,Закончен,"Сёнен, Демоны, Приключения, Экшен",65 эп. из 65,25 мин.,TMS Entertainment,"Сюжет сосредотачивается на карточной игре Vanguard, которая является популярной и соревновательной деятельностью среди молодежи. Главный герой, Айчи Сэндзана, изначально тихий и застенчивый парень, становится заинтересованным в игре Vanguard после случайной встречи с Тошикадзу Кай, опытным игроком. Под влиянием этой встречи, Айчи начинает участвовать в соревнованиях и развивать свои навыки в игре. Его цель - стать сильным игроком и найти себя в этом мире. Сюжет аниме следует за Айчи и его",https://animego-online.org/uploads/posts/2023-08/802253_1691720702.jpg
589,Кайдзи 2 сезон,2011,8.25,Закончен,"Приключения, Психология, Триллер",26 эп. из 26,25 мин.,Madhouse,"Сюжет второго сезона разворачивается после событий первого сезона. Кайдзи сталкивается с новыми вызовами, манипуляциями и схемами. Он оказывается в закрытом обществе, где участвует в различных играх, предназначенных для развлечения и унижения участников. Кайдзи и его спутники сталкиваются с опасностью, интригами и сложными решениями. Сериал исследует темы риска, спекуляции, азарта и человеческой природы в экстремальных ситуациях. Тайтл известен своим напряженным и драматическим сюжетом, а также",https://animego-online.org/uploads/posts/2023-08/666698_1691720521.jpg
591,Ты и я 1 сезон,2011,7.66,Закончен,"Сёнен, Комедия, Романтика, Школа, Драма, Повседневность",13 эп. из 13,25 мин.,J.C.Staff,"Сюжет сосредотачивается вокруг пятерых друзей - двух братьев-близнецов, Юки и Ютой Асаби, и их друзей Канами Цукинага, Сюн Митсумине и Масахиро Сакаи. Они учатся в старшей школе и разделяют веселые и повседневные моменты своей жизни. Сюжет не имеет строгой линии сюжета и вместо этого фокусируется на повседневных ситуациях, чередующихся от школьных забав до семейных моментов, первых любовных чувств и личных стремлениях. Главная особенность аниме - это его уютная и спокойная атмосфера, которая",https://animego-online.org/uploads/posts/2023-08/672963_1691720282.jpg
592,"Эй, люби меня всерьёз!",2011,6.68,Закончен,"Комедия, Романтика, Школа, Боевые искусства, Гарем, Приключения, Суперсила, Этти",12 эп. из 12,25 мин.,Lerche,"Сюжет сочетает элементы экшена, комедии, романтики и гарема. Сюжет сосредоточен на Тосино Кёхэй Ямато, студенте средней школы, который оказывается вовлеченным в различные приключения и сражения с группой девушек-воительниц, называющих себя ""Семьями"" и преследующих свои собственные цели. Ямато попадает в мир интриг и сражений, сталкиваясь с множеством сильных и эксцентричных девушек, каждая из которых имеет уникальные способности и характеры. В сюжете он развивает взаимоотношения с",https://animego-online.org/uploads/posts/2023-08/678839_1691719562.jpg
593,Поющий принц 1 сезон,2011,7.03,Закончен,"Сёдзё, Комедия, Романтика, Школа, Гарем, Музыка",13 эп. из 13,25 мин.,A-1 Pictures,"Сюжет фокусируется на главной героине, Гаретсу Харука, которая мечтает стать успешной композитором и автором песен. Она поступает в академию Saotome, престижное учебное заведение для молодых талантов, стремящихся стать звездами музыкальной индустрии. Здесь она обучается и сотрудничает с группой молодых и обаятельных парней, каждый из которых также стремится стать известным певцом или айдолом. Главная группа парней состоит из семи учеников: Токия Ичиносе, Рен Янами, Масато Хибики, Сю Хиираги,",https://animego-online.org/uploads/posts/2023-08/647194_1691719381.jpg
594,Стигматы квайзеров 2 сезон,2011,6.31,Закончен,"Магия, Приключения, Мистика, Суперсила, Экшен, Этти",12 эп. из 12,25 мин.,Hoods Entertainment,"Сюжет разворачивается в современном мире и описывает борьбу между различными фракциями, использующими магические сущности, называемые ""Квазарами"", для получения силы. Главный герой, Александр ""Саша"" Николаевич Герц, один из Qwaser (пользователей Квазаров), вместе со своей партнершей Мафией вступает в схватку с другими фракциями, стремясь достичь своих целей и разгадать тайны своего прошлого. Второй сезон продолжает исследование мира, населенного Квазарами, и динамику",https://animego-online.org/uploads/posts/2023-08/584033_1691719261.jpg
595,Гинтама 2 сезон,2011,9.04,Закончен,"Сёнен, Комедия, Пародия, Самураи, Фантастика, Фэнтези, Экшен",51 эп. из 51,24 мин.,Sunrise,"Сюжет разворачивается в альтернативном мире, где Землю захватили аманто - инопланетные существа. Главный герой Гинтоки Саката, вместе с его друзьями Шимурой Шинпачи и Кагурой, ведет небольшую фирму Odd Jobs, решая разнообразные проблемы и задачи. Несмотря на аманто и обстановку, мир остается забавно смешанным из феодальных традиций и современных технологий, что создает основу для пародий и комических ситуаций. Новый сезон продолжает эклектичный подход к жанрам и темам. Сериал известен своими",https://animego-online.org/uploads/posts/2023-08/1691849547_12.jpg
596,Лучшая в мире первая любовь 1 сезон,2011,7.65,Закончен,"Сёнен-ай, Комедия, Романтика, Драма",12 эп. из 12,23 мин.,Studio Deen,"Сюжет сосредотачивается на различных романтических отношениях между мужчинами в рабочей среде издательства манги и литературы. Главные герои сериала сталкиваются с прошлыми чувствами, страхами и непростыми решениями. Сериал имеет два основных сюжетных строя. Первый - это история о Ритики Онодере и Масамуне Такано. Ритика только что вернулся в мир манги и попал в издательство, где он ранее работал. Там он обнаруживает, что его бывший босс - Масамуне Такано, и их отношения становятся намного",https://animego-online.org/uploads/posts/2023-08/588922_1691718541.jpg
597,Дневник будущего,2011,7.42,Закончен,"Сёнен, Драма, Психология, Мистика, Экшен, Триллер",26 эп. из 26,26 мин.,asread.,"Это аниме, основанное на манге. Сюжет сосредоточен вокруг Юко Амано, старшеклассника, который случайно становится участником смертельной игры, участники которой обладают дневниками, предсказывающими будущее. Каждый участник имеет свой ""дневник будущего"", который сообщает им информацию о событиях, происходящих через некоторое время вперед. Главная цель - выжить и стать богом, обладающим безграничной властью над миром. Юко оказывается вовлеченным в этот темный мир среди других",https://animego-online.org/uploads/posts/2023-08/650663_1691717821.jpg
598,Внук Нурарихёна 2 сезон,2011,7.94,Закончен,"Сёнен, Демоны, Мистика, Фэнтези, Экшен",24 эп. из 24,24 мин.,Studio Deen,"Новый сезон продолжает рассказ о Рику Нурарихёне, молодом человеке, который является потомком могущественного Ёкайного клана Нурарихё. Он стоит на перекрестке между миром людей и миром Ёкай, и ему предстоит совладать со своей половиной Ёкайной природы и принять свое настоящее предназначение. Во втором сезоне Рику продолжает свои приключения, сталкиваясь с новыми опасностями и врагами. Он собирает вокруг себя армию сильных союзников, чтобы защитить свой клан и мир от угроз. Все это происходит во",https://animego-online.org/uploads/posts/2023-08/584034_1691717642.jpg
599,"Дурни, Тесты, Аватары 2 сезон",2011,7.68,Закончен,"Комедия, Романтика, Школа, Суперсила, Фэнтези",13 эп. из 13,25 мин.,SILVER LINK.,"Сериал продолжает следить за повседневной жизнью студентов школы Фумидзуки. В мире этого аниме студенты могут сражаться в боевых ситуациях, используя свои знания и способности, представленные в виде персональных статов. Они могут вызывать призванных существ, которые сражаются за них. Основные персонажи - это группа учеников, состоящая из эксцентричных личностей. Главный герой Акихиса Ёсии обозначается как ""Бака"" (т.е. ""дурак""), и он решает участвовать в специальных",https://animego-online.org/uploads/posts/2023-08/679759_1691717461.jpg
600,Синий экзорцист 1 сезон,2011,7.5,Закончен,"Сёнен, Школа, Приключения, Фэнтези, Экшен",25 эп. из 25,25 мин.,A-1 Pictures,"История сосредотачивается на Рине Окумуре, который обнаруживает, что он сын Сатаны. Рин решает стать экзорцистом - борцом с демонами - чтобы справиться со своей дьявольской природой и защитить мир от зловещих сил. В процессе обучения в Совете Экзорцистов, Рин и его друзья сталкиваются с опасными демонами, внутренними конфликтами и загадками своего прошлого. Сюжет исследует темы идентичности, дружбы, семейных уз и борьбы со своими внутренними бурями. Аниме сочетает в себе динамичные боевые сцены",https://animego-online.org/uploads/posts/2023-08/574182_1691717162.jpg
601,Уж не зомби ли это? 1 сезон,2011,7.35,Закончен,"Комедия, Гарем, Пародия, Приключения, Мистика, Фэнтези, Экшен, Этти",12 эп. из 12,25 мин.,Studio Deen,"Сюжет вращается вокруг Аямэ Айоси, парня-подростка, который нечаянно умирает, но благодаря загадочной девушке Ями, он воскрешается в виде зомби. С этого момента его жизнь претерпевает ряд странных изменений: он продолжает учиться в школе, в то время как его сердце остановилось, и он живет в одиночестве в мрачном подвале. Однажды Аямэ встречает девушку в военной форме, названную Серы, и даже попадает в сражение с необычным существом. Серя оказывается магическим воином, носителем магической брони",https://animego-online.org/uploads/posts/2023-08/574563_1691716862.jpg
602,Мария Холик 2 сезон,2011,6.95,Закончен,"Сёдзё-ай, Комедия, Школа, Драма, Пародия",12 эп. из 12,25 мин.,Shaft,"Второй сезон продолжает следить за Канако Миямуры, девушкой, которая страдает от андрофобии (боязни мужчин). Она переводится в девичью академию Акитсума, чтобы избежать контакта с мужчинами. Однако она скоро обнаруживает, что её новая соседка Мария - на самом деле мальчик, а школа полна разнообразных эксцентричных персонажей и ситуаций. Сюжетные линии включают в себя различные комические моменты, игры с шаблонами жанра и отсылки к аниме и поп-культуре. Сериал также акцентирует внимание на",https://animego-online.org/uploads/posts/2023-08/460398_1691716621.jpg
