id,name,year,rating,status,genre,episodes,time,studio,description,img
1,Поэзия теней 3 сезон,2023,6.72,Онгоинг,Фэнтези,25 эп.,25 мин.,Zexcs,"Хиро, молодой парень, просыпается и сразу же приглашается на завтрак своим дедушкой. В ходе завтрака Хиро начинает просить деда купить ему смартфон. Выйдя из дома, он оказывается в темноте, слышит непонятный голос, но момент быстро проходит. В подсобном помещении он находит устройство, похожее на смартфон, и радостно его включает. По пути в школу Хиро изучает функционал нового устройства. В школе он демонстрирует это устройство Мимори и Кадзуки, надеясь играть с ними в мобильные игры. Однако",https://animego-online.org/uploads/posts/2023-08/5174883_1691428081.jpg
2,История империи Тиамун,2023,7.22,Онгоинг,"Комедия, Фэнтези",12 эп. из 12,23 мин.,SILVER LINK.,"Принцесса Мию, столкнувшись с неминуемой гибелью и разрушением своей империи, Тиамун, внезапно находит себя в водовороте времени и оказывается в теле своего младшего ""я"". Такая неожиданная смена временных координат предоставляет ей второй шанс — возможность переписать историю и возможно спасти своё королевство от предстоящего краха. Теперь Мию имеет уникальный шанс провести ценные моменты со своими родителями и друзьями, которых она знала как утраченных в будущем. Она осознает, что ей",https://animego-online.org/uploads/posts/2023-10/0_1696891082.jpg
3,Заботы запертой принцессы вампиров,2023,7.38,Онгоинг,"Комедия, Вампиры, Фэнтези",11 эп. из 12,23 мин.,Project No.9,"История, описанная в вашем вопросе, рассказывает о приключениях принцессы вампиров, которая отправляется в мир людей, чтобы защитить их от опасной магической расы, называемой Сигма. Принцесса становится обычной школьницей, чтобы не привлекать к себе внимание и более эффективно искать Сигму. Ей помогает ее верный слуга, и вместе они сражаются против пришельцев. История подчеркивает конфликт между вампирами и людьми, а также проблемы доверия со стороны людей. Принцесса сталкивается с множеством",https://animego-online.org/uploads/posts/2023-10/0_1696889222.jpg
4,Паладин издалека 2 сезон,2021,7.23,Онгоинг,"Приключения, Фэнтези, Экшен",12 эп.,23 мин.,"OLM, Sunrise Beyond","В стране мёртвых, где обитают скелеты, призраки и мумии, человеческий ребёнок по имени Уилл оказывается лишённым прошлого и идентичности. Заботясь о нём, нечисть, состоящая из Блада, скелета, Гаса, прозрачного призрака, и Мэри, мумии, становится для Уилла своего рода семьёй. Вместе с этими странными, но преданными спутниками, Уилл пытается разгадать загадку своего прошлого и места в стране мёртвых. Он отправляется в путешествие, полное тайн и открытий, чтобы раскрывать свою настоящую сущность и",https://animego-online.org/uploads/posts/2023-10/4438605_1696890002.jpg
5,Семья шпиона 2 сезон,2023,0.0,Онгоинг,"Сёнен, Комедия, Экшен",12 эп.,24 мин.,"Wit Studio, CloverWorks","Эта история описывает комедийное приключение главного героя, известного шпиона ""Сумрака"", и его команды, которая создается для выполнения сложной и опасной миссии. Главной целью ""Сумрака"" является внедрение в преступную организацию, и чтобы оставаться незамеченным, ему нужно создать фиктивную семью. Вместе с убийцей, представляющей его ""невесту"", и молодой шпионкой, изображающей его дочь, они начинают жить двойной жизнью. По мере развития сюжета, фиктивная семья",https://animego-online.org/uploads/posts/2023-10/4686248_1696708982.jpg
6,Магия вернувшегося должна быть особенной,2023,7.06,Онгоинг,"Школа, Фэнтези, Экшен",12 эп. из 12,23 мин.,Arvo Animation,"Предстоит катастрофа глобальных масштабов, виновником которой является ""Теневой лабиринт"", поглощающий землю. Это не просто физическое место, а совокупность альтернативных миров, где ключевые события исказились и привели к катастрофическим результатам. Эти миры фактически представляют собой измерения, где история пошла по кривой дорожке, и именно там наши герои вступают в игру, стараясь исправить ход событий посредством выполнения определенных заданий. Успех приносит бонусы и",https://animego-online.org/uploads/posts/2023-10/0_1696891503.jpg
7,Монолог фармацевта,2023,8.61,Онгоинг,"Детектив, Драма",12 эп. из 24,23 мин.,"OLM, TOHO animation STUDIO","Этот рассказ повествует о молодой женщине по имени Макото, которая живет в японскую эпоху Эдо. Она профессионально занимается изготовлением лекарств и помогает людям обрести здоровье, используя для этого лечебные травы и различные медикаменты. Макото не обладает сверхъестественными способностями, но благодаря своим обширным знаниям и опыту она способна помочь тем, кто в этом нуждается. Ее жизнь проста и полностью посвящена своему ремеслу, и хотя она уделяет всё время своей работе, в ее сердце",https://animego-online.org/uploads/posts/2023-11/6548ae1e319ce_1699261982.jpg
8,Не ешь сырую свинину,2023,6.31,Онгоинг,"Комедия, Фэнтези",11 эп. из 12,23 мин.,Project No.9,"История рассказывает о необычном приключении главного героя, который сталкивается с магическим происшествием после попытки попробовать блюдо из свиного печени в забегаловке возле вокзала. В результате плохо приготовленного блюда он теряет сознание и просыпается в совершенно иной реальности, находясь в теле маленького поросёнка. Этот персонаж, несмотря на свою новую форму, сохраняет воспоминания из своей прошлой жизни. Основной сюжет истории заключается в том, как главный герой, находясь в теле",https://animego-online.org/uploads/posts/2023-10/0_1696891022.jpg
9,Мой новый босс глупый,2023,7.29,Онгоинг,Комедия,12 эп. из 12,23 мин.,A-1 Pictures,"Эта история рассказывает о Момосе, молодом человеке, пережившем разочарования и испытания, особенно в связи с унижением со стороны предыдущего начальника. Его жизнь меняется, когда он встречает нового начальника, Ширасаки, который отличается искренностью и вниманием к Момосе. Под его руководством Момосе начинает новую главу своей жизни, чувствуя себя ценным и уважаемым членом команды. История подчеркивает важность поддержки, внимания и уважения со стороны начальства в рабочей среде. Под",https://animego-online.org/uploads/posts/2023-10/0_1696891621.jpg
10,Безупречный мир,2021,7.44,Онгоинг,"Приключения, Фэнтези, Экшен",124 эп. из 130,19 мин.,Foch Films,"Рожденный в уникальном мире, где деревни сражаются за власть и контроль, главный персонаж Ши Хао - гений, благословленный небесами, рожденный в самых неблагоприятных условиях. Однако его клан имеет таинственное прошлое. Чтобы подняться и стать тем гением, для которого он предназначен, клан прикладывает все усилия, чтобы помочь ему в культивации, сражаясь с фанатичными монстрами и вступая в борьбу за власть с другими кланами. Его путешествие приведет его сквозь неизведанные земли, пока он не",https://animego-online.org/uploads/posts/2023-08/64e431f280dd1_1692676594.jpg
11,Рагна Багровый,2023,7.8,Онгоинг,"Сёнен, Фэнтези, Экшен",12 эп. из 24,24 мин.,SILVER LINK.,"Эта история разворачивается в мире, где драконы управляют землей, небом и морем, и никакие другие существа не могут сравниться с их мощью и властью. В этом мире есть люди, стремящиеся вызвать драконов на бой, надеясь одержать победу, но это требует преодоления человеческой слабости и нахождения способа сравниться с этими могущественными существами. Главным героем и охотником на драконов является Рагне, который после многих лет тренировок и сражений осознает, что даже его собственные усилия",https://animego-online.org/uploads/posts/2023-10/0_1696846322.jpg
12,Владыка духовного меча 4 сезон,2020,7.07,Онгоинг,"Романтика, Боевые искусства, Приключения, Фэнтези, Экшен",346 эп.,11 мин.,Soyep,"Юный герой, смелый и отважный, прославляется своим мастерством владения мечом и саблей, становясь легендой среди своего народа. Его путешествие начинается с благородных намерений – истребить зло и защитить тех, кто близок ему. Однако тень прошлого омрачает его дорогу, когда он решает воссоединиться со своей пропавшей сестрой. Судьба, однако, несет ему не только трагическое возвращение сестры, но и мрачные загадки, которые ставят под угрозу не только его семью, но и весь мир. Внутренние демоны и",https://animego-online.org/uploads/posts/2023-09/4298911_1694028962.jpg
13,Противостоящий небесам,2021,6.96,Онгоинг,"Боевые искусства, Фэнтези, Экшен",260 эп. из 260,10 мин.,Soyep,"Главный герой пережил череду трагедий, потеряв всех, кого он любил. Смерть близких стала для него первым ударом, но вскоре он осознал, что и его верные друзья не оказались такими, какими казались. Они оказались жестокими и эгоистичными, думая лишь о своем благополучии. Похищение его возлюбленной стало следующим шокирующим событием. Вместо того чтобы сойти с ума, герой выбрал путь борьбы и мщения. В душе молодого Тань Юня теперь господствует одно чувство — жажда мести. Он решен довести свое дело",https://animego-online.org/uploads/posts/2023-09/4962868_1693946282.jpg
14,"Моя дочь, отправившаяся в столицу, захотев стать авантюристом, достигла S-ранга",2023,0.0,Онгоинг,"Магия, Приключения, Фэнтези, Экшен, Исекай",13 эп.,23 мин.,Typhoon Graphics,"Не каждому удается стать истинным авантюристом. Например, Бельгрив, который покинул армию досрочно из-за серьезного ранения, не смог осуществить свою мечту стать великим искателем приключений. Вместо этого он вернулся в свой родной край и начал трудиться простым деревенским тружеником. Однажды, блуждая по горам, он встретил маленькую девочку по имени Анджелина и решил взять ее под свою опеку. С годами девочка проявила удивительное мастерство в обращении с мечом, а Бельгрив стал ее наставником.",https://animego-online.org/uploads/posts/2023-09/65183c8b9abfa_1696087179.jpg
15,Семь смертных грехов: Четыре всадника Апокалипсиса,2023,6.89,Онгоинг,"Сёнен, Магия, Приключения, Фэнтези, Экшен",10 эп. из 24,23 мин.,Telecom Animation Film,"Эта история рассказывает о приключениях Персиваля, живущего изолированно с дедом Баргисом на вершине горы ""Божественный палец"". Он никогда не имел опыта общения с другими людьми и ведет уединенную жизнь, но его мир переворачивается в день его 16-летия, когда на них нападает загадочный воин в алой броне. Этот воин получил задание истребить всех, кто походит на четверых ""Всадников Апокалипсиса,"" группу воинов, предназначенных свергнуть короля Артура согласно предсказанию.",https://animego-online.org/uploads/posts/2023-10/0_1696892223.jpg
16,Провожающая в последний путь Фрирен,2023,8.95,Онгоинг,"Сёнен, Драма, Приключения, Фэнтези",16 эп.,25 мин.,Madhouse,"Десять лет назад группа авантюристов одержала победу над Королем Демонов и вернула мир в волшебное королевство. Этот отважный отряд включал в себя человека по имени Химмель, гнома-воина Эйзена, жреца Хейтера и эльфийку-чародейку Фрирен. После завершения их подвига Фрирен намеревается отправиться в путешествие, исследуя другие регионы. Перед тем как разойтись, они наслаждаются редким метеоритным дождем, который происходит всего лишь дважды за столетие, и договариваются встретиться снова во время",https://animego-online.org/uploads/posts/2023-10/0_1696890482.jpg
17,Королевство руин,2023,7.59,Онгоинг,"Сёнен, Драма, Фэнтези, Экшен",12 эп. из 12,24 мин.,Yokohama Animation Lab,"Сюжет аниме ""Королевство руин"" разворачивается в мире, где люди и ведьмы долгое время жили в мире и гармонии. Однако события принимают жестокий оборот, когда наука достигает новых высот, и людям больше не нужна помощь ведьм. Ведьмы становятся объектами дискриминации, и на них начинается охота, уносящая множество жизней. Ключевую роль в этом конфликте и важное решение принимает Адонис, один из последователей ведьмы, который теряет всю свою семью и близких. Ощущая несчастье и гнев,",https://animego-online.org/uploads/posts/2023-10/0_1696889642.jpg
18,Восхождение Героя щита 3 сезон,2023,7.0,Онгоинг,"Драма, Магия, Приключения, Фэнтези, Экшен, Исекай",12 эп. из 12,24 мин.,Kinema Citrus,"Главного героя, Наофуми Иватани, призвали в параллельный мир в качестве героя, но он не был единственным - вместе с ним было призвано ещё трое людей, каждому из которых было вручено свое особенное оружие. Их число составляло четыре: меч, лук, копье и щит. В начале все шло хорошо, и все горожане полюбили Наофуми и остальных героев. Однако в какой-то момент местные жители почему-то стали считать, что щит - бесполезное оружие, и начали противостоять ему. Главному герою пришлось столкнуться с",https://animego-online.org/uploads/posts/2023-10/1235052_1696604942.jpg
19,Убийца гоблинов 2 сезон,2023,7.54,Онгоинг,"Магия, Приключения, Фэнтези, Экшен",12 эп. из 12,23 мин.,LIDENFILMS,"В этом мире обитает разнообразие рас, включая людей, эльфов, дварфов и многих других. Однако, также существует множество видов монстров, таких как драконы, огры и гоблины. Сегодня мы обратим внимание именно на гоблинов, которых часто считают самыми слабыми и недооцененными среди всех остальных существ. Но это весьма обманчивое впечатление, так как они обладают разумом и действуют сообща, их жестокость не знает границ. Гоблины похищают девушек и используют их как средства размножения, а также",https://animego-online.org/uploads/posts/2023-11/65549e89770f4_1700044425.jpg
20,История знакомства опытной тебя и неопытного меня,2023,6.77,Онгоинг,"Романтика, Школа",12 эп. из 12,23 мин.,ENGI,"Это история о типичном школьнике по имени Руюто Касима, который проиграл в игре ""Признание в любви"" и его новой задачей стало признание в любви к Руне Сиракаве. Коротко говоря, Руна была идеальной красавицей и самой популярной девушкой в школе. Однако, всё пошло совсем не так, как он планировал, потому что Руна прямо заявила, что она свободна и готова начать отношения. Руюто случайно слышал, как Руна отвергла предложение спортивного парня из футбольной команды. Руна пригласила Руюто,",https://animego-online.org/uploads/posts/2023-10/0_1696891442.jpg
21,Магическая битва 2 сезон,2023,8.8,Онгоинг,"Сёнен, Школа, Магия, Ужасы, Фэнтези, Экшен",22 эп. из 23,23 мин.,MAPPA,"Юджи Итадори выделялся среди своих сверстников тем, что не разделял их страсть к спорту, а предпочитал заниматься оккультизмом. Этот выбор был обусловлен тяжелыми событиями в его жизни. Он потерял близкого человека, своего дедушку. Возраст уже не позволял старику быть крепким, и он заболел, в результате чего скончался в больнице. Медицинская помощь оказалась бессильной, и перед смертью дедушка попросил Юджи совершать добрые поступки и помогать нуждающимся. Парень оказался в ситуации, где ему",https://animego-online.org/uploads/posts/2023-08/1381125_1691425621.jpg
22,Восхождение в тени 2 сезон,2023,8.55,Онгоинг,"Комедия, Фэнтези, Экшен",12 эп. из 12,24 мин.,Nexus,"Продолжение увлекательной истории о молодом парне, живущем в современной Японии. Главный герой оставляет впечатление скромного и спокойного паренька, который предпочитает скрываться в тени, а не выходить на публику. Его большой момент и возможность проявить себя наступят, когда он окажется в мире мечей и магии. Здесь Сид станет мощным воином с уникальными способностями властвовать над стихиями. Чтобы стать настоящим героем этих земель, ему предстоит собрать вокруг себя отважную команду и",https://animego-online.org/uploads/posts/2023-10/4901749_1696450023.jpg
